{
  "$schema": "https://json-schema.org/draft/2020-12/schema",
  "title": "Signal Schedule Employee Experience & Data Tools Read Contract",
  "type": "object",
  "required": ["templates", "imports", "exports", "profileFields", "roleInheritance"],
  "properties": {
    "roleInheritance": { "type": "array", "items": { "type": "string" } },
    "templates": { "type": "array", "items": { "type": "object" } },
    "imports": { "type": "array", "items": { "type": "object" } },
    "exports": { "type": "array", "items": { "type": "object" } },
    "profileFields": { "type": "array", "items": { "type": "object" } }
  }
}
