{
  "roleInheritance": ["Employee", "Supervisor", "Admin", "System Admin"],
  "templates": [
    { "id": "tmpl-223-days", "name": "2-2-3 Days Template", "type": "pattern", "status": "active", "updated": "2026-06-14" },
    { "id": "tmpl-min-dispatch", "name": "Minimum Dispatch Staffing", "type": "coverage", "status": "active", "updated": "2026-06-14" },
    { "id": "tmpl-holiday-staffing", "name": "Holiday Staffing Template", "type": "schedule", "status": "draft", "updated": "2026-06-14" }
  ],
  "imports": [
    { "id": "imp-employees", "name": "Employees", "status": "ready", "notes": "CSV/XLSX staging with duplicate detection." },
    { "id": "imp-availability", "name": "Availability", "status": "planned", "notes": "Employee availability windows and restrictions." },
    { "id": "imp-patterns", "name": "Patterns", "status": "planned", "notes": "Shift patterns, rotations, and short-day rules." }
  ],
  "exports": [
    { "id": "exp-employees", "name": "Employee Export", "format": "xlsx", "status": "ready" },
    { "id": "exp-schedule", "name": "Schedule Snapshot Export", "format": "xlsx", "status": "planned" },
    { "id": "exp-availability", "name": "Availability Export", "format": "csv", "status": "planned" }
  ],
  "profileFields": [
    { "field": "contactInfo", "label": "Contact information", "owner": "employee", "adminReview": true },
    { "field": "notificationPreferences", "label": "Notification preferences", "owner": "employee", "adminReview": false },
    { "field": "qualifications", "label": "Qualifications", "owner": "admin", "adminReview": true },
    { "field": "schedulePreferences", "label": "Schedule preferences", "owner": "employee", "adminReview": true }
  ]
}
